{
  "kind": "decision-matrix",
  "scope": "universal",
  "version": "1",
  "description": "Maps canonical data_size_gb ranges to recommended database migration tooling.",
  "selector": "data_size_gb",
  "matrix": {
    "<10": { "tool": "pg_dump", "mysql_tool": "mysqldump", "notes": "Fast, simple, minimal downtime for small DBs" },
    "10-500": { "tool": "pgcopydb", "mysql_tool": "mydumper", "notes": "Parallel copy, handles medium datasets efficiently" },
    ">500": { "tool": "AWS DMS", "mysql_tool": "AWS DMS", "notes": "Strongly recommended for large DBs; note DMS cannot do CDC with Heroku Postgres (no REPLICATION role)" },
    "unknown": { "tool": "pgcopydb", "mysql_tool": "mydumper", "notes": "Default when size unknown — safe middle ground" }
  },
  "absent_behavior": "use_default",
  "overrides": [],
  "entries": []
}
