{
  "kind": "normalization",
  "scope": "source:gcp",
  "version": "1",
  "description": "Maps GCP Terraform resource types to canonical workload models consumed by decide tools.",
  "last_verified": "2026-06-14",
  "entries": [
    {
      "source_type": "google_sql_database_instance",
      "archetype": "relational-db",
      "field_map": {
        "engine": {
          "from": "database_version",
          "transform": { "POSTGRES_*": "postgres", "MYSQL_*": "mysql", "SQLSERVER_*": "sqlserver" }
        },
        "availability": {
          "from": "settings.availability_type",
          "transform": { "ZONAL": "single-az", "REGIONAL": "multi-az" }
        },
        "size_class": {
          "from": "settings.tier",
          "transform": { "db-f1-micro": "micro", "db-g1-small": "small", "db-custom-*": "medium" }
        }
      },
      "notes": "multi-az-ha and multi-region are never inferred from IaC — require Q6 user answer"
    },
    {
      "source_type": "google_cloud_run_service",
      "archetype": "container",
      "field_map": {
        "service_type": "container",
        "timeout_seconds": { "from": "template.spec.timeout_seconds", "transform": {} },
        "memory_gb": { "from": "template.spec.containers[0].resources.limits.memory", "transform": {} },
        "vcpu": { "from": "template.spec.containers[0].resources.limits.cpu", "transform": {} }
      }
    },
    {
      "source_type": "google_cloud_run_v2_service",
      "archetype": "container",
      "field_map": {
        "service_type": "container",
        "timeout_seconds": { "from": "template.timeout", "transform": {} },
        "memory_gb": { "from": "template.containers[0].resources.limits.memory", "transform": {} },
        "vcpu": { "from": "template.containers[0].resources.limits.cpu", "transform": {} }
      },
      "notes": "v2 API uses slightly different config paths than v1"
    },
    {
      "source_type": "google_cloudfunctions_function",
      "archetype": "function",
      "field_map": {
        "service_type": "function",
        "timeout_seconds": { "from": "timeout", "transform": {} },
        "memory_gb": {
          "from": "available_memory_mb",
          "transform": { "128": 0.125, "256": 0.25, "512": 0.5, "1024": 1, "2048": 2, "4096": 4, "8192": 8 }
        },
        "runtime": { "from": "runtime", "transform": {} }
      },
      "notes": "Gen 1 Cloud Functions. Memory in MB → converted to GB for canonical model."
    },
    {
      "source_type": "google_cloudfunctions2_function",
      "archetype": "function",
      "field_map": {
        "service_type": "function",
        "timeout_seconds": { "from": "build_config.service_config.timeout_seconds", "transform": {} },
        "memory_gb": { "from": "build_config.service_config.available_memory", "transform": {} },
        "runtime": { "from": "build_config.runtime", "transform": {} },
        "vcpu": { "from": "build_config.service_config.available_cpu", "transform": {} }
      },
      "notes": "Gen 2 Cloud Functions (built on Cloud Run). Paths differ from Gen 1."
    },
    {
      "source_type": "google_app_engine_application",
      "archetype": "container",
      "field_map": {
        "service_type": "container"
      },
      "notes": "App Engine workloads are containerized web apps. Classify as container archetype."
    },
    {
      "source_type": "google_compute_instance",
      "archetype": "vm",
      "field_map": {
        "service_type": "vm",
        "vcpu": {
          "from": "machine_type",
          "transform": {
            "n2-standard-2": 2,
            "n2-standard-4": 4,
            "n2-standard-8": 8,
            "e2-medium": 2,
            "e2-standard-4": 4
          }
        },
        "memory_gb": {
          "from": "machine_type",
          "transform": {
            "n2-standard-2": 8,
            "n2-standard-4": 16,
            "n2-standard-8": 32,
            "e2-medium": 4,
            "e2-standard-4": 16
          }
        },
        "gpu": { "from": "guest_accelerator", "transform": { "present": true, "absent": false } }
      }
    },
    {
      "source_type": "google_container_cluster",
      "archetype": "container",
      "field_map": {
        "service_type": "container"
      },
      "notes": "GKE is a container orchestration platform. Archetype is 'container' (not 'kubernetes') — K8s preference is a signal for RESOLVE, not a different workload type."
    },
    {
      "source_type": "google_firestore_database",
      "archetype": "nosql-document",
      "field_map": {
        "service_type": "nosql-document"
      }
    }
  ]
}
